<?xml version="1.0" encoding="UTF-8"?>
<form	xmlns="http://www.todoyu.com/schema/form"
		xmlns:xsi="http://www.w3.org/2001/XMLSchema-instance"
		xsi:schemaLocation="http://www.todoyu.com/schema/form ../../../../core/config/form.xsd">
	<attributes>
		<attribute name="action">index.php?ext=loginpage&amp;controller=ext&amp;action=forgotPassword</attribute>
		<attribute name="name">forgotpassword</attribute>
		<attribute name="class">formLogin</attribute>
	</attributes>
	<fieldsets>

		<fieldset name="forgotPasswordDialog">
			<class>loginForm</class>
			<elements>

				<field type="comment" name="status">
					<comment>loginpage.ext.forgotpassword.form.field.comment</comment>
				</field>

				<field type="text" name="usernameoremail">
					<label>loginpage.ext.form.field.usernameoremail</label>
					<required />
				</field>

			</elements>
		</fieldset>

		<fieldset name="buttons">
			<class>buttons</class>
			<elements>

				<field type="button" name="submit">
					<text>loginpage.ext.forgotpassword.form.field.submit</text>
					<type>submit</type>
					<class>sendNewPasswordButton</class>
					<onclick>Todoyu.Ext.loginpage.submitForgotPasswordForm(this.form)</onclick>
					<hasIcon />
				</field>

				<field type="button" name="cancel">
					<text>loginpage.ext.forgotpassword.form.field.cancel</text>
					<class>buttonCancel cancel</class>
					<hasIcon />
					<onclick>Todoyu.Ext.loginpage.cancelForgotPasswordForm(this.form)</onclick>
				</field>

			</elements>
		</fieldset>

	</fieldsets>
</form>